title,body,post_id,score,upvote_ratio,flair,created_time,num_comments,author_id,url,distinguished,is_original_content,over_18
'They don't deserve this': Netizens appalled by photos showing migrant worker working in sewer pipe,NULL,wml6ys,0,0.44,News,2022-08-12 21:23:28+08:00,3,bbse2o7b,http://www.asiaone.com/singapore/they-dont-deserve-netizens-appalled-photos-showing-migrant-worker-working-sewer-pipe,,False,False
"'This is for you, Singapura': Filipino maid runs 57km to celebrate National Day",NULL,wml4g3,4,0.75,News,2022-08-12 21:20:08+08:00,3,bbse2o7b,http://www.asiaone.com/singapore/you-singapura-filipino-maid-runs-57km-celebrate-national-day,,False,False
Last-minute Reservist Deferment?,"Hi all,

I'm a PES-C NS man slated for my first reservist cycle with SCDF **next week** (PSC ICT whatever that means).

Having a bit of a headache because I'm meant to go for a surgery next month and have a one-month pre-op diet where I am only allowed to consume 800 kcal per day through meal replacement shakes.

The doctors have recommended that I don't go for my reservist training as I'll be very weak and have to monitor my blood sugar, etc. I have a **hospital note** with me asking for deferment of my reservice.

The problem is I've only been able to secure the note **this week** due to some complications with my surgery date (it had to get postponed, I was bouncing between clinics trying to get an earlier surgery date). I've been informed today that there isn't enough time to get my deferment processed and will need to contact my NS commander. And due to my presumptiveness, I didn't tell my employer about my reservist cycle because I thought it would be deferred — mistake on my part was underestimating how much long it would take to get a deferment.

Not sure if it's my cynicism from NS (I had very bad commanders) or paranoia, but I have some doubts as to whether I can get my reservist postponed by calling up my unit office and submitting the hospital note.

It seems unlikely to me that I'll be forced to go for training (albeit this is a PES-C program) when  
a government hospital has written a note requesting for me not to go. BUT I have a healthy fear of things not making sense in national service-related bureaucracy.

Guess I'm trying to assuage my concerns by asking if anyone knows what this last-minute process is like?

My worst-case scenario is I'll have to attend the training without much of the proper attire or equipment (the op is to help me lose weight so I didn't buy any new uniforms), screw my workplace team over. Best case scenario is I can defer the training to a few months later.",wmjyj5,0,0.43,Serious Discussion,2022-08-12 20:23:05+08:00,9,85agrvzv,https://www.reddit.com/r/singapore/comments/wmjyj5/lastminute_reservist_deferment/,,False,False
K-pop group Super Junior to perform in Singapore on Sep 3,NULL,wmjj2n,0,0.5,News,2022-08-12 20:00:36+08:00,0,6z4wpym0,https://cnalifestyle.channelnewsasia.com/entertainment/k-pop-group-super-junior-perform-singapore-sep-3-325811,,False,False
Singaporean man given life sentence for murdering his wife while on holiday in the UK,NULL,wmjgjj,21,0.95,News,2022-08-12 19:57:16+08:00,10,4l1qqy8i,https://www.channelnewsasia.com/singapore/fong-soong-hert-murder-wife-newscastle-life-sentence-holiday-uk-2876421,,False,False
high paying part time jobs that don't require much skill,"what are some jobs that don't require skills/qualifications but pay well? for reference, I consider $10/hour average, $8 and below on the low side, and am looking for something that pays $12 or more, the higher the better (e.g. i heard bars/ night life places pay more than the usual F&B rates?). just a uni kid looking to make some dough during sem time, all suggestions are appreciated!",wmiydp,0,0.44,Discussion,2022-08-12 19:29:51+08:00,26,f355hfl,https://www.reddit.com/r/singapore/comments/wmiydp/high_paying_part_time_jobs_that_dont_require_much/,,False,False
Shock at inflation value today.,Just realise today that a hot milo at boardway food court is 1.50 and cold one is 2.10. Was pretty sure the cold one was still 1.50/1.60 at the start of this year. How much has the drinks in your area inflated by?,wmi47w,56,0.86,Discussion,2022-08-12 18:42:07+08:00,52,2nzc38qy,https://www.reddit.com/r/singapore/comments/wmi47w/shock_at_inflation_value_today/,,False,False
Most Singaporeans feel more united than before COVID-19 pandemic; other countries see increased division: Survey,NULL,wmhzyh,22,0.69,News,2022-08-12 18:34:50+08:00,30,d998c9ok,https://www.channelnewsasia.com/singapore/covid-19-united-divided-pandemic-handling-management-vaccines-pew-2876451,,False,False
Your Say: Learn from the SAF in managing workplace accidents,NULL,wmhp91,0,0.45,Opinion / Fluff Post,2022-08-12 18:16:44+08:00,20,9h7o291,https://www.todayonline.com/voices/your-say-learn-saf-managing-workplace-accidents-1968061,,False,False
Lotte duty free shop at Changi Airport seems to cost a lot more than the old DFS?,"I was a little tired when I landed, can anybody help sanity check the fact that the Duty Free shop operated by Lotte in Changi has absolutely no good deal at all? Everything seems as expensive or more expensive than outside... the closest to a small discount I could find is Jack Daniels. So for genuine duty free shopping, I probably should buy before boarding the plane?",wmho3j,33,0.92,Discussion,2022-08-12 18:14:52+08:00,8,b7bfqco1,https://www.reddit.com/r/singapore/comments/wmho3j/lotte_duty_free_shop_at_changi_airport_seems_to/,,False,False
‘Our mistake’ to flee Singapore: Couple accused of cheating in Tradenation luxury goods scam charged,NULL,wmhm16,20,0.81,News,2022-08-12 18:11:31+08:00,21,au1pv8l8,https://www.channelnewsasia.com/singapore/tradenation-luxury-goods-scam-couple-charged-court-pi-jiapeng-siriwipa-pansuk-2876126,,False,False
"Former Woodgrove Secondary School HOD loses appeal, to begin jail term for taking student funds",NULL,wmgx1k,33,0.85,News,2022-08-12 17:28:00+08:00,2,1eqdt8vc,https://www.channelnewsasia.com/singapore/woodgrove-secondary-school-hod-english-teacher-take-student-funds-2876551,,False,False
Parents’ dialect groups to appear in digital birth certificates after initial exclusion: ICA,NULL,wmgfvn,12,0.71,News,2022-08-12 16:57:49+08:00,2,6z4wpym0,https://www.channelnewsasia.com/singapore/parents-dialect-groups-appear-digital-birth-certificates-after-initial-exclusion-ica-2876536,,False,False
Any Mooncake Tasting for this year's Takashimaya Mid-Autumn Festival?,"Anyone that went to the Mid-autumn festival at Takashimaya, were there any mooncake tasting? Went last year but they didn't have it due to COVID but not sure if this year is any different.",wmg3gt,4,0.59,Discussion,2022-08-12 16:35:44+08:00,4,5ogzd3m,https://www.reddit.com/r/singapore/comments/wmg3gt/any_mooncake_tasting_for_this_years_takashimaya/,,False,False
"[MV] My Katong, My Kampung",NULL,wmg00m,0,0.45,"Photos, Videos",2022-08-12 16:29:47+08:00,3,4hkwxlf2,https://youtu.be/8mOd12j5iWY,,False,False
Future expansion of the Singapore MRT 2022-2040s,NULL,wmfd8v,8,0.66,Unverified,2022-08-12 15:50:00+08:00,2,44yz7paj,https://youtu.be/UkdYGDQGYuA,,False,False
18-year-old charged with scamming users over Marquee Singapore nightclub tickets,NULL,wmes2m,23,0.74,News,2022-08-12 15:13:18+08:00,0,51r50ub5,https://www.todayonline.com/singapore/teen-scammed-telegram-marquee-tickets-1967866,,False,False
Thoughts on M1 Fibre Broadband?,"Not a knowledgeable person in this area so thought of seeking some advice here.

Was thinking of getting the 1GBPS m1 deal at 39.90/mth. It comes with free router - either TPlink Archer Ax72 / ASUS RT-AX55.

Any existing users of this router / fibre broadband from M1, would u be able to comment of its performance? 

Also, if this router isnt paritcularly strong, i was thinking of purchasing the TPlink deco mesh system to make sure there are no dead spots at home. 

If so, do you guys have any advice / better value-for-money deals out there?",wme2k5,16,0.75,Discussion,2022-08-12 14:29:39+08:00,34,94vqfu8p,https://www.reddit.com/r/singapore/comments/wme2k5/thoughts_on_m1_fibre_broadband/,,False,False
Analysis | Singapore’s Next Big Challenge Is Already Here,NULL,wmdzie,16,0.77,News,2022-08-12 14:24:22+08:00,10,o97gxzo0,https://www.washingtonpost.com/business/singapores-next-big-challenge-is-already-here/2022/08/11/b962c4ce-19cf-11ed-b998-b2ab68f58468_story.html,,False,False
"Le Le, first panda cub born in S'pore, celebrates first birthday",NULL,wmd88b,78,0.89,News,2022-08-12 13:40:08+08:00,15,6z4wpym0,https://www.straitstimes.com/singapore/environment/giant-panda-cub-born-in-singapore-celebrates-first-birthday,,False,False
Egyptian Chef & Singaporean Wife Sell Fusion Roti John & Kebab At Hawker Stall In Chomp Chomp,NULL,wmbq19,47,0.85,News,2022-08-12 12:18:26+08:00,2,am0eouxu,https://www.todayonline.com/8days/egyptian-chef-singaporean-wife-sell-fusion-roti-john-kebab-hawker-stall-chomp-chomp-1966451,,False,False
I met Jackson Wang & found out that one of his fav childhood movies is 'I Not Stupid',NULL,wmb555,0,0.43,Tabloid/Low-quality source,2022-08-12 11:48:47+08:00,16,51r50ub5,https://mothership.sg/2022/08/jackson-wang-interview/,,False,False
Always love it when Singapore gets mentioned in a big franchise,NULL,wmb0ba,797,0.96,"Photos, Videos",2022-08-12 11:42:01+08:00,36,8leubtvu,https://i.redd.it/kyptl4zle7h91.jpg,,False,False
TIL McDonald Breakfast has no beef in their breakfast menu,"I was Q~ing for breakfast in McDonald, the patron is asking for beef burger pointing to McMuffin.  
  
The manager replied there are no beef in the menu. Then I did a quick Google to find out that Sausage McMuffin is actually chicken!  
  
Mindblown!",wma0ti,59,0.74,Discussion,2022-08-12 10:54:00+08:00,63,1y6vqagg,https://www.reddit.com/r/singapore/comments/wma0ti/til_mcdonald_breakfast_has_no_beef_in_their/,,False,False
Forum: Singapore should bid to host Commonwealth Games in 2030,NULL,wm98g7,0,0.33,Opinion / Fluff Post,2022-08-12 10:16:24+08:00,29,51r50ub5,https://www.straitstimes.com/opinion/forum/forum-singapore-should-bid-to-host-commonwealth-games-in-2030,,False,False
"Ghostlore: In this made-in-Singapore video game, you get to fight hungry ghosts and pontianaks",NULL,wm8jdx,147,0.94,News,2022-08-12 09:43:39+08:00,11,6z4wpym0,https://cnalifestyle.channelnewsasia.com/living/ghostlore-singapore-video-online-game-hungry-ghost-pontianak-325486,,False,False
"Newspaper article on Jollibee’s first expansion to Singapore, 1985. Reading this personally, it’s pretty clear why the first foray failed.",NULL,wm65go,222,0.94,"Photos, Videos",2022-08-12 07:53:36+08:00,49,8uzc3ol7,https://i.redd.it/du55fouu96h91.jpg,,False,False
Seat hogging? Man punches woman in the face at MacPherson getai,NULL,wm60ov,257,0.97,News,2022-08-12 07:47:21+08:00,86,bbse2o7b,http://www.asiaone.com/singapore/seat-hogging-man-punches-woman-face-macpherson-getai,,False,False
Singtel and Gomo,"Horrible experience with them. I attempted to port over from my current starhub plan to gomo and was told that was phone number is a prepaid plan. So I contact support and was basically told that since my phone number was once a prepaid plan (that was 8 years ago), gomo's system is registrating my number as a prepaid phone number and thus, the only way to port over will be to purchase the $30 Singtel SIMOnly, and then change to Gomo. I have never encountered such issue before with other telcos when I was porting and so this seems like just some shady business practice rather than actual technical limitations. 

I need some advise on the best way forward to this, paying the full $30 just to port over temporarily is just ridiculous.

Edit: Many of you seem to be thinking that I'm porting from a prepaid number. I am currently on a starhub Postpaid number. But they said that my number has a history of being a prepaid number (that's 8 years ago before I converted to a postpaid plan) and thus I will have to go through Singtel. 
Starhub Postpaid -> Singtel Postpaid -> Gomo Postpaid",wm3z9h,0,0.29,Discussion,2022-08-12 06:17:28+08:00,9,k0h39znt,https://www.reddit.com/r/singapore/comments/wm3z9h/singtel_and_gomo/,,False,False
"/r/singapore random discussion and small questions thread for August 12, 2022","Talk about your day. Anything goes, but subreddit rules still apply. Please be polite to each other!",wm3kdi,8,0.73,,2022-08-12 06:00:11+08:00,634,6l4z3,https://www.reddit.com/r/singapore/comments/wm3kdi/rsingapore_random_discussion_and_small_questions/,,False,False
"NTUC launches year-long exercise to engage Singaporean workers, discuss their concerns",NULL,wm39e9,0,0.24,News,2022-08-12 05:47:07+08:00,9,vjhr0h9,https://www.straitstimes.com/singapore/jobs/ntuc-launches-year-long-exercise-to-engage-singaporean-workers-discuss-their-concerns,,False,False
"Billionaire Peter Lim's name, image used in online chats by impersonator; police reports filed",NULL,wlxli2,15,0.8,News,2022-08-12 01:50:12+08:00,13,6z4wpym0,https://www.straitstimes.com/singapore/courts-crime/billionaire-peter-lims-name-image-used-in-online-chats-by-impersonator-police-reports-filed,,False,False
Nightlife with Covid,Hi! I’m a student from the United States thinking about studying at NUS through an exchange program in January. Nightlife isn’t my top priority but its definitely a factor in my study abroad decision. Wondering if clubs are back to normal at all? And if not does it seem like  they will be by January? Thanks!,wlwip0,0,0.5,Discussion,2022-08-12 01:04:18+08:00,3,8gsramo9,https://www.reddit.com/r/singapore/comments/wlwip0/nightlife_with_covid/,,False,False
this is just infuriating,NULL,wlw4cv,69,0.68,"Photos, Videos",2022-08-12 00:47:50+08:00,98,5qtzxx9j,https://www.reddit.com/gallery/wlw4cv,,False,False
From a Gundam Fan: Happy National Day Singapore!,NULL,wlvg77,259,0.96,I Made This,2022-08-12 00:20:05+08:00,36,d60wiy2,https://i.redd.it/aqk3zlpv04h91.jpg,,True,False
Fascinated by Singapore’s Brutalism - Can anyone help us get a closer look?,"Hello everyone, my friend and I are in love with Singapore’s Brutalist landmarks: Golden Mile & People’s Park Complex. We are wondering if anyone on this sub lives in either of these buildings and would be willing to show us around. We are urban planning/archi students at NUS and would love to have a closer look into what life is like as a resident at these places. If you’d be willing to do this please let me know through pm. We could buy you dinner or something like that to show our appreciation. 

Also if you have any memories, stories, or thoughts of these places that you’d like to share please comment below, especially about Golden Mile Complex as it will be going under a redevelopment project in the coming year.",wltvs1,54,0.83,Discussion,2022-08-11 23:15:11+08:00,21,3v137vxa,https://www.reddit.com/r/singapore/comments/wltvs1/fascinated_by_singapores_brutalism_can_anyone/,,False,False
Man arrested for allegedly burning National Day decorations,NULL,wlt5k4,25,0.88,News,2022-08-11 22:45:13+08:00,6,6z4wpym0,https://www.channelnewsasia.com/singapore/man-arrested-allegedly-burning-national-day-decorations-2874676,,False,False
Fewer homeless people sleeping on S'pore streets last year; city area has highest number,NULL,wls5mk,24,0.87,News,2022-08-11 22:02:13+08:00,5,vjhr0h9,https://www.straitstimes.com/singapore/community/fewer-homeless-people-sleeping-on-spore-streets-last-year-city-area-has-highest-numbers,,False,False
Timelapse from Singapore Flyer,"First visit on flyer, courtesy of SG rediscover voucher ✌🏼",wlr20v,29,0.72,"Photos, Videos",2022-08-11 21:11:08+08:00,9,cr1sh,https://v.redd.it/3em4n49qk4h91,,False,False
"Woman calls out expat man for only dating Southeast Asian women, says they 'could do so much better'",NULL,wlqmhk,0,0.45,News,2022-08-11 20:50:38+08:00,51,8lvvfnix,https://www.asiaone.com/singapore/woman-calls-out-expat-man-only-dating-southeast-asian-women-says-they-could-do-so-much,,False,False
"Drinks outlets must label beverages high in sugar, saturated fat on their menus by end-2023",NULL,wlqip6,379,0.99,News,2022-08-11 20:45:12+08:00,94,ojuqd,https://www.straitstimes.com/singapore/health/drinks-outlets-must-label-beverages-high-in-sugar-saturated-fat-on-their-menus-by-end-2023,,False,False
Adrian Pang tapped depression to throw NDP 'birthday bash' for Singapore,NULL,wlp22x,18,0.7,News,2022-08-11 19:26:50+08:00,8,3d6rv89u,https://www.straitstimes.com/singapore/adrian-pang-tapped-his-depression-to-throw-ndp-birthday-bash-for-singapore,,False,False
Some shots from this years NDP combined rehearsals!,NULL,wlp1uj,618,0.97,"Photos, Videos",2022-08-11 19:26:26+08:00,31,1sh4i8i,https://www.reddit.com/gallery/wlp1uj,,True,False
Natasha x Azuan Tan NDP2022 crying man!,NULL,wlp0yn,0,0.16,"Photos, Videos",2022-08-11 19:24:59+08:00,3,ohw9j,https://youtu.be/O9pdRaZ5NmM,,False,False
Factchecking Jason Wong & Mohd Khair’s “377A: Putting Children First”,NULL,wlotmh,58,0.74,Serious Discussion,2022-08-11 19:13:01+08:00,20,ujq9y,https://medium.com/@davian_aw/factchecking-jason-wong-mohd-khairs-377a-putting-children-first-baa029d2ed47?fs=e&s=cl,,False,False
The Indian selling Chinese zi char: The Blacky Seafood,NULL,wlocl1,44,0.84,News,2022-08-11 18:45:31+08:00,20,cpt8lfzq,https://youtu.be/sSbj5Cp7ipo,,False,False
McDonald's at Queensway's Japanese-themed garden reopens after makeover,NULL,wlo783,129,0.96,Tabloid/Low-quality source,2022-08-11 18:36:19+08:00,10,51r50ub5,https://mothership.sg/2022/08/mcdonalds-ridout-tea-garden-reopen/,,False,False
"Luxury goods scam: Fugitive couple arrested in Johor Bahru, brought back to Singapore",NULL,wlo3zg,623,0.98,News,2022-08-11 18:30:37+08:00,185,6z4wpym0,https://www.todayonline.com/singapore/luxury-goods-scam-couple-arrested-1967161,,False,False
Lion City Sailors and Kim Do-hoon mutually agree to part ways; Academy Technical Director Luka Lalic appointed as interim coach,NULL,wlnqdn,18,0.8,News,2022-08-11 18:07:03+08:00,10,zdn6i,https://www.lioncitysailorsfc.sg/lion-city-sailors-and-kim-do-hoon-mutually-agree-to-part-ways-academy-technical-director-luka-lalic-appointed-as-interim-coach/,,False,False
Report names dozens of Singapore firms involved in arms supply to Myanmar military | MalaysiaNow,NULL,wlnol0,106,0.92,News,2022-08-11 18:03:44+08:00,34,o97gxzo0,https://www.malaysianow.com/news/2022/08/11/report-names-dozens-of-singapore-firms-involved-in-arms-supply-to-myanmar-military,,False,False
askST Jobs: I've been working from home and feeling invisible. How can I get my boss to notice me?,NULL,wlnld2,12,0.66,News,2022-08-11 17:58:46+08:00,16,4coxyp6h,https://www.straitstimes.com/singapore/jobs/askst-jobs-ive-been-working-from-home-and-feeling-invisible-how-can-i-get-my-boss-to-notice-me,,False,False
Those made jobless during Covid-19 pandemic among new groups of homeless people: Study,NULL,wln063,91,0.93,News,2022-08-11 17:20:05+08:00,58,1ae8o0nv,https://www.straitstimes.com/singapore/community/those-made-jobless-among-new-groups-of-homeless-people-study,,False,False
Three people arrested after a fight near Paya Lebar Road,NULL,wlmx9o,12,0.8,News,2022-08-11 17:14:44+08:00,10,1eqdt8vc,https://www.channelnewsasia.com/singapore/three-people-arrested-fight-viral-video-police-2873876,,False,False
Tunku Abdul Rahman's Full Speech in Parliament When He Was Tabling the Constitution Amendment Bill to Separate Singapore from Malaysia,NULL,wlmcij,212,0.95,Politics,2022-08-11 16:37:23+08:00,48,4qyj99he,https://www.reddit.com/gallery/wlmcij,,False,False
Tax collection rises 22.4% to $60.7 billion in last financial year: Iras,NULL,wllv7d,55,0.92,News,2022-08-11 16:05:51+08:00,13,vjhr0h9,https://www.straitstimes.com/business/economy/tax-collection-rises-224-to-607-billion-last-financial-year-iras,,False,False
Has anyone managed to get a cash refund from Jetstar due to covid cancellations?,"I booked a trip to Taiwan with Jetstar 2 years back, and it was cancelled when Taiwan border closed due to covid. I was issued with vouchers despite my insistence to get cash, and now I'm engaging with them again to get my cash back instead of extending the expiry date of the vouchers.

Super tilt that I can't get my cash refund two years after my booking. I requested to talk to their supervisor, but not sure if it'll work out.

Has anyone managed to get their cash refund from Jetstar due to covid cancellations?",wlluf2,2,0.54,Discussion,2022-08-11 16:04:30+08:00,5,8moq4j5h,https://www.reddit.com/r/singapore/comments/wlluf2/has_anyone_managed_to_get_a_cash_refund_from/,,False,False
"Pump operators in Singapore cut petrol, diesel prices",NULL,wll52k,6,0.72,News,2022-08-11 15:18:26+08:00,1,d998c9ok,https://www.straitstimes.com/singapore/transport/pump-operators-except-caltex-cutpetrol-diesel-prices,,False,False
Letter: Singapore is not alone in capital punishment laws,NULL,wll2ve,40,0.74,Opinion / Fluff Post,2022-08-11 15:14:36+08:00,64,mudpnp4,https://www.ft.com/content/417d033e-a934-4b4c-ab74-904b4543e6e4,,False,False
"More pirate attacks expected in Singapore Strait this year amid Ukraine war, report says",NULL,wljg6l,122,0.93,Tabloid/Low-quality source,2022-08-11 13:33:29+08:00,37,6z4wpym0,https://www.scmp.com/week-asia/politics/article/3188471/more-pirate-attacks-expected-singapore-strait-year-amid-ukraine,,False,False
"Letter to the Editor | School canteen food prices increased, but the quality & quantity of food portions decreased - The Independent Singapore News",NULL,wlj5u4,4,0.54,Tabloid/Low-quality source,2022-08-11 13:16:45+08:00,16,1eqdt8vc,https://theindependent.sg/letter-to-the-editor-school-canteen-food-prices-increased-but-the-quality-quantity-of-food-portions-decreased/,,False,False
Man gets life imprisonment for murdering girlfriend's 9-month-old son,NULL,wlippj,149,0.94,News,2022-08-11 12:51:25+08:00,55,3d6rv89u,https://www.channelnewsasia.com/singapore/murder-9-month-old-baby-mohamed-aliff-head-injury-van-floorboard-2873556,,False,False
'We don't always get it right': Grab Singapore's managing director on meeting consumer expectations,NULL,wlgkfd,0,0.31,News,2022-08-11 10:59:40+08:00,20,9giowhev,https://www.channelnewsasia.com/singapore/grab-singapore-managing-director-yee-wee-tang-customers-expectations-2872976,,False,False
Forum: Subtitles make it possible to enjoy English films again,NULL,wlggry,0,0.5,Opinion / Fluff Post,2022-08-11 10:54:41+08:00,18,51r50ub5,https://www.straitstimes.com/opinion/forum/forum-subtitles-make-it-possible-to-enjoy-english-films-again,,False,False
Accidental fame for proud Singaporean who cried during National Anthem at NDP 2022,NULL,wlfi1o,158,0.86,News,2022-08-11 10:07:54+08:00,44,3onsmzzo,https://www.channelnewsasia.com/singapore/ndp-crying-man-national-anthem-azuan-tan-proud-singaporean-2871131,,False,False
Singapore narrows 2022 GDP growth forecast to 3-4% amid further deterioration in global economic outlook,NULL,wle7um,7,0.7,News,2022-08-11 09:07:28+08:00,4,6z4wpym0,https://www.channelnewsasia.com/singapore/singapore-gdp-3-4-growth-deterioration-global-economic-outlook-weakened-2873236,,False,False
Today I learnt: I've been sitting on the MRT seats wrong all along,NULL,wldwb1,640,0.95,Opinion / Fluff Post,2022-08-11 08:51:54+08:00,95,2zpkbkmi,https://i.redd.it/vcz4ahgbfzg91.jpg,,False,False
Sharing some shots of our military on display during #NDP2022.,NULL,wldsc6,274,0.94,"Photos, Videos",2022-08-11 08:46:46+08:00,10,oo46i,https://www.reddit.com/gallery/wldsc6,,False,False
meanwhile on the NDP Youtube Channel.,NULL,wld99p,796,0.96,"Photos, Videos",2022-08-11 08:20:57+08:00,75,2n9hfb6v,https://www.reddit.com/gallery/wld99p,,False,False
"Woman sunbathes in swimsuit at HDB block, sets tongues wagging",NULL,wlbggr,124,0.82,Opinion / Fluff Post,2022-08-11 06:57:32+08:00,130,bbse2o7b,http://www.asiaone.com/singapore/woman-sunbathes-swimsuit-hdb-block-sets-tongues-wagging,,False,False
'Please don't jump the gun': Diner regrets complaining to manager about service in restaurant,NULL,wlbewo,70,0.88,News,2022-08-11 06:55:34+08:00,16,bbse2o7b,http://www.asiaone.com/singapore/please-dont-jump-gun-diner-regrets-complaining-manager-about-service-restaurant-staff-with-autism,,False,False
"/r/singapore random discussion and small questions thread for August 11, 2022","Talk about your day. Anything goes, but subreddit rules still apply. Please be polite to each other!",wla3j1,16,0.87,,2022-08-11 06:00:12+08:00,674,6l4z3,https://www.reddit.com/r/singapore/comments/wla3j1/rsingapore_random_discussion_and_small_questions/,,False,False
Former Sri Lankan president said to be leaving S'pore for Bangkok on Aug. 11,NULL,wl90wu,3,0.56,Tabloid/Low-quality source,2022-08-11 05:14:59+08:00,2,eb9jk,https://mothership.sg/2022/08/gotabaya-rajapaksa-leaving-spore-for-bangkok/,,False,False
"Better opportunities, ease of getting residency among reasons foreign nurses leave S'pore to work abroad",NULL,wl3zbm,61,0.94,News,2022-08-11 01:53:49+08:00,25,6z4wpym0,https://www.todayonline.com/singapore/better-opportunities-residency-foreign-nurses-leave-singapore-1966436,,False,False
NDP2022 from Tanjong Rhu,NULL,wl3l19,55,0.84,"Photos, Videos",2022-08-11 01:37:42+08:00,2,4evpcwwf,https://i.redd.it/q9tvjskv9xg91.jpg,,False,False
"My landlord installed a camera in my room to check on the aircon, is that even allowed lol.",NULL,wl2elx,376,0.97,Discussion,2022-08-11 00:50:41+08:00,111,4mvdnuxe,https://i.redd.it/cm5f08kh1xg91.jpg,,False,False
Missing cat at Hougang Street 32,NULL,wl06oh,318,0.98,"Photos, Videos",2022-08-10 23:21:51+08:00,38,gh95w,https://i.redd.it/co8p8aailwg91.jpg,,False,False
[PingWest 品玩] Chinese article on Shopee's Decline,NULL,wkzs3d,74,0.9,News,2022-08-10 23:05:30+08:00,47,8bovn372,https://www.pingwest.com/a/268448,,False,False
