title,body,post_id,score,upvote_ratio,flair,created_time,num_comments,author_id,url,distinguished,is_original_content,over_18
Happy National Day Singapore," Singapore becomes independent in 1965, when it is actually expelled from Malaysia, I guess the only country in the world that become independent forcibly.  It was earlier part of the Malay federation along with Borneo and Sarawak.

 However the Singapore state Govt differed with the Malaysian Govt, especially on the special privileges given to Malays.  Lee Kuan Yew then Singapore CM, led the demand advocating equal treatment for all races in Malaysia.  Add to it the increasing racial tensions between the Chinese and Malays, especially the 1964 riots, on June 21, that saw many Chinese attacked, and their shops, properties looted. There were economic tensions too. 

 Also there was a fear that Singapore then being the economically dominant province, it would dominate Kuala Lumpur. Singapore had restrictions on trade, with rest of Malayisa, and in turn it refused loans to Sabah and Sarawak. 

 With the UMNO rhetoric rising, and calls to arrest Lee Kuan Yew, then Malaysian PM, thought it would be better to expel Singapore from the Federation, which is how it became an independent nation by force, but proved better in the long run. 

&#x200B;

https://preview.redd.it/n6txn2uj4mg91.png?width=360&format=png&auto=webp&s=5cf690231b372f20640c68fdf4e8484a9d8a4bc5

https://preview.redd.it/pkohhwak4mg91.png?width=360&format=png&auto=webp&s=6bcfd1103fb3fd5d0837dcc61cf7b78ee7781314

https://preview.redd.it/q5apytsk4mg91.png?width=360&format=png&auto=webp&s=062d11cab0e51bea27c7840aaf1d4bc9e0a7d506

https://preview.redd.it/dgogwl8l4mg91.png?width=360&format=png&auto=webp&s=9853f43c9cd7e3416bd5d6d88e59b1e436ba49f7",wjtjy8,83,0.81,Discussion,2022-08-09 12:09:15+08:00,12,2j408pkr,https://www.reddit.com/r/singapore/comments/wjtjy8/happy_national_day_singapore/,,False,False
Happy birthday Singapore!,NULL,wjtea3,768,0.98,I Made This,2022-08-09 12:00:50+08:00,36,2unuq87x,https://www.reddit.com/gallery/wjtea3,,False,False
WhT is the most patriotic thing one can do in Singapore on National Day.,Let the ideas flow. I’m working today so your ideas will be keeping me company.,wjte3t,0,0.29,Opinion / Fluff Post,2022-08-09 12:00:37+08:00,40,rvmpy,https://www.reddit.com/r/singapore/comments/wjte3t/wht_is_the_most_patriotic_thing_one_can_do_in/,,False,False
“The Fourth Trimester” by Checkpoint Theatre brings up many issues regarding pregnancy and married life. Has anybody watched it? Would love to hear your thoughts!,NULL,wjt99k,8,0.58,"Photos, Videos",2022-08-09 11:53:34+08:00,10,51p5c0p1,https://i.redd.it/c2ac3mkx1mg91.jpg,,False,False
Never Forgetti,NULL,wjsljc,2243,0.97,"Photos, Videos",2022-08-09 11:19:50+08:00,105,oq4ii0y0,https://v.redd.it/6yyqacvrvlg91,,False,False
I recreated the livery of the F-16 Black Knights and F-15SG RSAF50 as a mod in Ace Combat 7.,NULL,wjqr8m,302,0.96,I Made This,2022-08-09 09:53:09+08:00,26,13l351,https://v.redd.it/qvc91es9glg91,,False,False
Double rainbow over Lentor Hillock,NULL,wjpiu0,237,0.94,"Photos, Videos",2022-08-09 08:55:14+08:00,15,566u0,https://www.reddit.com/gallery/wjpiu0,,False,False
13 weeks' jail for doctor who filmed clinic assistant showering at work,NULL,wjpb4a,54,0.89,News,2022-08-09 08:45:20+08:00,30,liytxwj0,https://www.straitstimes.com/singapore/courts-crime/13-weeks-jail-for-doctor-who-filmed-clinic-assistant-showering-at-work,,False,False
"happy birthday, singapore!","dear singapore,

i whine about you a lot -
you are so flawed, yet amongst all these flaws, i am able to find a semblance of security and stability i still haven’t been able to find elsewhere.

a land full of opportunities during my grandparent’s time; a land full of unknowns, where they gambled everything and chose to settle here. thank you for being the foundation of my security, especially in my earlier years.

some of my saddest memories have unfolded on your soil - i have felt my worst heartbreaks, disappointments and shed more tears here than anywhere else; and yet these tears, ironically, have helped me to grows roots and be cemented here. now, you hold some of my fondest and most precious memories, too.

in this ephemeral lifetime, i have gone to the himalayas and back, called a few other places home along the way, but you’re the only place that will always have a special place my heart. right here.

happy birthday, singapore.",wjp8aj,50,0.67,Opinion / Fluff Post,2022-08-09 08:41:55+08:00,8,1u1kjj7f,https://www.reddit.com/r/singapore/comments/wjp8aj/happy_birthday_singapore/,,False,False
S'porean charged with wife's murder in UK tells court he does not remember killing her,NULL,wjp7te,91,0.93,News,2022-08-09 08:41:26+08:00,18,6z4wpym0,https://www.straitstimes.com/singapore/courts-crime/sporean-charged-with-wifes-murder-in-uk-tells-court-he-does-not-remember-killing-her,,False,False
Singapore paddler Feng Tianwei being presented with the David Dixon award | Commonwealth Games 2022,NULL,wjp1p6,101,0.89,News,2022-08-09 08:33:44+08:00,3,d998c9ok,https://www.youtube.com/watch?v=7eQVM4EvHI8,,False,False
and another day - national day 2022,NULL,wjp171,62,0.75,I Made This,2022-08-09 08:33:04+08:00,8,o8vn6lup,https://i.redd.it/tcunwwg32lg91.png,,True,False
"/r/singapore random discussion and small questions thread for August 09, 2022","Talk about your day. Anything goes, but subreddit rules still apply. Please be polite to each other!",wjlifc,5,0.6,,2022-08-09 06:00:14+08:00,649,6l4z3,https://www.reddit.com/r/singapore/comments/wjlifc/rsingapore_random_discussion_and_small_questions/,,False,False
"Travel takes top spot in S'pore consumers' non-essential spending; more choose to buy now, pay later",NULL,wjl9i3,13,0.68,News,2022-08-09 05:50:02+08:00,7,vjhr0h9,https://www.straitstimes.com/business/travel-takes-top-spot-in-spore-consumers-non-essential-spending-with-more-choosing-to-buy-now-pay-later,,False,False
Hey guys was called out to pick up trash at cck cemetery at 3am here are the pics. Did this cause I want to do a r/Singapore beach clean up more info in the comments. Also happy National Day🇸🇬🇸🇬🇸🇬,NULL,wji8x3,727,0.96,"Photos, Videos",2022-08-09 03:47:22+08:00,60,kwwi75jb,https://www.reddit.com/gallery/wji8x3,,False,False
"'A storm is gathering around us,' says Singapore's PM Lee amid US-China tensions",NULL,wjg0lh,29,0.74,News,2022-08-09 02:18:34+08:00,42,6z4wpym0,https://ph.news.yahoo.com/singapore-pm-lee-us-china-tensions-124957505.html,,False,False
'Doesn't really make a difference': Ang Mo Kio SERS residents shrug at chance to apply for BTO flat in the estate,NULL,wjdge2,8,0.65,News,2022-08-09 00:37:49+08:00,9,1eqdt8vc,https://www.channelnewsasia.com/singapore/doesnt-make-difference-ang-mo-kio-sers-residents-bto-flat-estate-replacement-2866761,,False,False
Happy NDP 2022,NULL,wjcs81,75,0.87,I Made This,2022-08-09 00:11:02+08:00,14,4lt4ld2f,https://v.redd.it/3u5f0xz7fig91,,False,False
Overcharged in restaurant,"
I went for dinner at a restaurant and realised when I got home I’d been overcharged a significant amount. I went back the next day and complained in person, they said they’d take care of it. A few days later, I had to email following up as there’d been no contact, and they replied saying they agreed to the complaint and would refund the overcharged amount. It’s now a week later and no refund (and no responses to further emails). I’m intending to file a case with CASE, but is there any statutory authority I can report the restaurant to? I think SFA only deals with hygiene of food (please correct me if I’m wrong). Thank you.",wjce7f,18,0.76,Serious Discussion,2022-08-08 23:56:01+08:00,10,7c0mu1hp,https://www.reddit.com/r/singapore/comments/wjce7f/overcharged_in_restaurant/,,False,False
"'Huh, you siao ah?' Singaporean moves to Chile for year-long 'honeymoon', stays for 5 years",NULL,wjbrp5,87,0.89,Opinion / Fluff Post,2022-08-08 23:30:43+08:00,8,5drps2e1,https://www.asiaone.com/lifestyle/huh-you-siao-ah-singaporean-moves-chile-year-long-honeymoon-stays-5-years?utm_medium=Social&utm_source=Facebook&fbclid=IwAR1JpnMqg5CXOUjt9TkbTgjr_Gd7kzKj7nB9K3RNj9UGxF6bc5s2SUG--x4&fs=e&s=cl#Echobox=1659969138,,False,False
NDP 2022 Theme Song - Stronger Together | Piano Cover,NULL,wjbot0,30,0.75,I Made This,2022-08-08 23:27:19+08:00,2,36ij14l4,https://v.redd.it/bs84g5vp5ig91,,True,False
Woman kicked cop in groin during arrest after creating ruckus in Sembawang,NULL,wjb5o4,63,0.92,News,2022-08-08 23:05:45+08:00,24,6z4wpym0,https://www.straitstimes.com/singapore/courts-crime/jail-and-fine-for-woman-who-kicked-policeman-in-the-groin,,False,False
Best splurge meal in Singapore?,"I'll be coming round Singapore in a couple weeks, and am looking for one splurge meal to cap off my trip. I hope to be predominantly eating at hawker stalls, but was looking to set aside ~$150 SG (including tax + tip, and I don't need to drink) for an exceptional meal to cap off the trip.

Hoping to have something unique to Singapore (so ideally not French/Italian/Continental that I can get back home). If anyone here has had any exceptional meals, let me know!

(Also any other recommendations across budgets are welcomed :)",wjan2c,108,0.93,Discussion,2022-08-08 22:44:56+08:00,82,nlgc0,https://www.reddit.com/r/singapore/comments/wjan2c/best_splurge_meal_in_singapore/,,False,False
False Celling Break at Westgate (Singapore Atrium Sale),NULL,wj9slt,51,0.83,"Photos, Videos",2022-08-08 22:09:03+08:00,12,51r50ub5,https://v.redd.it/9sxhtywtyhg91,,False,False
Singaporean foods you can't find in Malaysia,"Malaysian here travelling to Singapore next week. Food has always been the mainstay of my travels but there's no way I'm travelling there just to eat... let's say food that I can find in abundance in Malaysia.

After some homework, here are some local Singaporean foods that (to my knowledge) are not common in Malaysia (we won't make a fuss if you claim these).

1. Singaporean Hokkien mee (fried prawn mee)
2. Bak chor mee
3. Katong laksa
4. Hainanese curry rice
5. Tze char (at least the phrase)
6. Satay bee hoon
7. EDIT: Fishball mee pok
8. EDIT: Tao suan (credits to [/u/Traditional\_Bell7883/](https://www.reddit.com/user/Traditional_Bell7883/))
9. EDIT: Black chye tao kueh (credits to [/u/potatetoe\_tractor/](https://www.reddit.com/user/potatetoe_tractor/))
10. EDIT: Prawn vadai (credits to /u/aWitchonthisEarth)

I'm definitely gonna give all of them a try, so your suggestions on where to have them would be much appreciated! If there's anything else worth a shout... shout!",wj9bvx,57,0.81,Discussion,2022-08-08 21:49:15+08:00,103,e00e6,https://www.reddit.com/r/singapore/comments/wj9bvx/singaporean_foods_you_cant_find_in_malaysia/,,False,False
Singapore-based crypto lender Hodlnaut suspends withdrawals,NULL,wj8ypc,66,0.92,News,2022-08-08 21:32:10+08:00,38,o97gxzo0,https://www.channelnewsasia.com/business/hodlnaut-cryptocurrency-singapore-suspend-withdrawals-2867036,,False,False
"Funeral director gets jail for unauthorised credit card charges of S$356,000, attempted witness tampering",NULL,wj8vhf,10,0.7,News,2022-08-08 21:28:04+08:00,7,am0eouxu,https://www.channelnewsasia.com/singapore/funeral-director-credit-card-unauthorised-payment-2867006?cid=FBcna,,False,False
The Wah Lau Gang and Singapore's Favourite Singlish Songs | Singlish: Why We Talk Like That? (Extra),NULL,wj8gaj,6,0.62,"Photos, Videos",2022-08-08 21:08:07+08:00,0,ohw9j,https://youtu.be/RSLEkP3tUbk,,False,False
Did someone press the release button a day early or something?,NULL,wj8avx,56,0.86,"Photos, Videos",2022-08-08 21:01:07+08:00,14,5peq6klc,https://v.redd.it/e7yw97i74jg91,,False,False
"StarHub says 'not tuned to react to sudden surge of users', after weekend Premier League broadcast issues",NULL,wj8bxf,21,0.76,News,2022-08-08 21:02:24+08:00,25,6os9gcsd,https://www.channelnewsasia.com/singapore/starhub-epl-english-premier-league-broadcast-issues-stream-2866546,,False,False
Ceiling leakage at Westgate,NULL,wj81pj,94,0.93,"Photos, Videos",2022-08-08 20:49:12+08:00,27,q2ezv,https://v.redd.it/3wu9nsfkkhg91,,False,False
"Post on woman taking up 4 seats on S'pore bus backfires, photo taker told to mind own business",NULL,wj7469,56,0.82,Tabloid/Low-quality source,2022-08-08 20:02:21+08:00,22,6z4wpym0,https://mothership.sg/2022/08/take-up-4-seats-bus/,,False,False
"Low inflation and interest rates ‘not likely to return anytime soon’, says PM Lee in National Day message",NULL,wj664g,44,0.8,News,2022-08-08 19:11:09+08:00,36,1eqdt8vc,https://www.channelnewsasia.com/singapore/national-day-message-2022-lee-hsien-loong-inflation-geopolitical-tensions-2866886,,False,False
"Our Padang: The green, green grass of home",NULL,wj60z2,3,0.57,News,2022-08-08 19:03:15+08:00,4,2stf,https://www.straitstimes.com/multimedia/graphics/2022/08/our-padang-75th-national-monument-singapore/index.html,,False,False
"Went for an interview, one of the interviewers got really insulted that I negotiated for a slight increase.","I want a second opinion on this, so I wanted to share the full story of what actually happened.

I went for an interview for a job that was paying between 2.3 - 2.5k it was a 5.5 day job that was opened for people with 'no experience'.

I was quite excited about it and applied for the job, fast forward later I got a video interview. The video interview went well enough. 

What I learned about the job was it was a 'family business' and the interviewer (daughter) love highlighting the fact that their business paid better compared to other businesses and they had really long term workers who worked for them. Sounded good I thought. I said goodbye to the interviewer and looked forward to hearing again from her. 
 
Few days passed and I got a message to have a face to face appointment with another lady (mother), I accepted it, of course. I went there and learn the ins-and-outs of working there. It went well enough and there wasn't anything else to say about it other than the fact again, this older lady keeps highlighting the fact that their business paid more compared to other companies. 

After the tour we had a face to face to talk about certain expectations for the job, questions, and things like that. So first thing was 'notice period', I was currently a part time teacher, and I said my job, I need to give a months notice. The lady told me ""but part timers are usually 3 weeks notice, not one""
So I said, okay but the fact is I did check with my colleagues prior to this and they too agreed it was one month. I said to her, I will check with my boss again for confirmation.

After a few more questions and conversation, I brought up the issue of salary. As it was a 5.5 day job, I wanted to try negotiating a salary of 2.4 instead of the 2.3k, I asked if it was okay to have a salary of 2.4k instead or is 2.3k a fixed amount?, and she mentioned that because I had no experience in said job, I couldn't request for that amount. I just agreed, and didn't say much about it. 

So she was friendly throughout everything and I thought things went well for the time, I never got the vibe that anything was wrong. 

Few days later I got a message from the original interviewer (daughter) that told me 'I was the only candidate that never provided a notice period' and until I could provide a notice period and copy of my current job, I would not be considered. So I went to collect and shared my current contract that stipulated it was a '1 month' notice period, like I mentioned before. 

Few days later I got a message saying she wanted to talk to me again, and I agreed. 
When she called me in the evening I was honestly very shocked by her tone. She sounded so angry at me like I did something wrong. She started with ""What exactly did you say to make them so unhappy"". I explained my situation, I did not say anything that was untoward and I apologize profusely in case I did say anything wrong. 

Apparently she explained that asking for the salary increase had made then leave a bad impression of me, lady(mom) who was on a face to face interview with me had let the others know about me negotiating about the pay increase. According to her, they were really unhappy and said things like ""they are just a part timer with no experience, not even a full timer and still asking for 2.4k"" and also the fact I couldn't bring up my current job contract/notice (Again, please note I have mentioned my notice period during the interview originally)

I was honestly shock at how they reacted. I had to explain to her what exactly I had said and how I did not argue for the salary or anything, that I was fine with the current pay after her explanation. 
She had told me she will have to have a discussion with the rest and if I got rejected/accepted she will let me know. 

Anyways last night, I decided to withdrew from the job application. I felt it wasn't worth the headache to go through such a thing during the interview period. If they were acting this way and talking shit behind your back for the interview, why should I try to stay? 

For the record though, i would like to mention my previous full time jobs were 2.5k and they were 5 day jobs. This particular one wanted to pay 2.3k for a 5.5 day job. Also most of the job interviews I went to have never asked to see my current job contract, so I was also abit taken aback by the request.

Was I in the wrong? I just wanted to get this off my chest cause it was really bothering me last night. I would appreciate a 2nd opinion.

Edit: Since everyone seems to be curious, I was applying for a job related to healthcare.

Edit 2: I can't reveal the name of the company cause that'll be considered Doxxing lah bros, and I don't wanna get into trouble. Sorry!",wj5vk3,706,0.96,Discussion,2022-08-08 18:54:58+08:00,244,7taw3,https://www.reddit.com/r/singapore/comments/wj5vk3/went_for_an_interview_one_of_the_interviewers_got/,,False,False
