title,body,post_id,score,upvote_ratio,flair,created_time,num_comments,author_id,url,distinguished,is_original_content,over_18
Close shave for woman as three ceiling beams fall 3 floors in Far East Plaza,NULL,wkzad9,21,0.84,News,2022-08-10 22:45:28+08:00,9,51r50ub5,https://www.straitstimes.com/singapore/consumer/close-shave-for-woman-as-three-ceiling-beams-fall-3-floors-in-far-east-plaza,,False,False
Tow truck driver dies after being pinned between pillar and bus in Kranji in 32nd work-related death this year,NULL,wkz0vm,63,0.9,News,2022-08-10 22:34:30+08:00,3,6z4wpym0,https://www.straitstimes.com/singapore/tow-truck-driver-dies-after-being-pinned-between-pillar-and-bus-32nd-work-related-death-this-year,,False,False
This map I saw with a really big Singapore,NULL,wkyd5f,50,0.76,"Photos, Videos",2022-08-10 22:06:48+08:00,14,5peq6klc,https://i.redd.it/4rt03kz88wg91.jpg,,False,False
How Singapore Airlines Now Serves Fresh Fish on the World’s Longest Flight | WSJ,NULL,wkx567,15,0.71,"Photos, Videos",2022-08-10 21:13:38+08:00,9,ohw9j,https://youtu.be/HPdB7g5ODsM,,False,False
Someone created a trailer for an updated VR Man.,NULL,wkwx41,15,0.72,"Photos, Videos",2022-08-10 21:03:43+08:00,2,fgipg,https://www.youtube.com/watch?v=B-N05QURIb8,,False,False
Woman initially upset about service calls for patience for Clementi Mall Swensen's employees with autism,NULL,wkwwnr,70,0.88,Tabloid/Low-quality source,2022-08-10 21:03:07+08:00,33,3odrq0ox,https://mothership.sg/2022/08/swensens-clementi-mall-autistic-employees/,,False,False
Teen arrested over tweet that claimed explosive device was placed at NDP venue,NULL,wkwdqo,255,0.97,News,2022-08-10 20:38:41+08:00,98,g5e9szrt,https://www.straitstimes.com/singapore/teen-arrested-over-tweet-that-claimed-explosive-device-was-placed-at-ndp-venue,,False,False
A Trainspotter’s Favourite Moment from NDP 2022,NULL,wkwcab,3,0.57,Opinion / Fluff Post,2022-08-10 20:36:40+08:00,0,10g7te,https://blog.sgtrains.com/2022/08/a-trainspotters-favourite-moment-from-ndp-2022/,,False,False
I'm looking for printable digital artwork from historic(1920 or earlier) Singapore and SE Asia(open to elsewhere). Has anyone used local archives or other sources they can share?,"I want to print some of them quite big; A0, which is (841x1188mm) so I need quite large DPI.  Hoping someone has a source they have used to get such large printable files.

Looking for paintings and sketches mostly. Portraits, ships, landscapes, ect.  


Thank you in advance.",wkwb4b,0,0.5,Serious Discussion,2022-08-10 20:35:05+08:00,4,f1061,https://www.reddit.com/r/singapore/comments/wkwb4b/im_looking_for_printable_digital_artwork_from/,,False,False
"Esso cuts diesel price by 11 cents, petrol prices by 9 cents",NULL,wkvby6,3,0.62,News,2022-08-10 19:46:55+08:00,1,d998c9ok,https://www.straitstimes.com/singapore/transport/esso-cuts-diesel-price-by-11-cents-petrol-prices-by-9-cents,,False,False
James Dyson receives Public Service Star award for contributions to S'pore's economic growth,NULL,wkv6yd,0,0.43,Tabloid/Low-quality source,2022-08-10 19:39:36+08:00,21,51r50ub5,https://mothership.sg/2022/08/singapore-james-dyson-award/,,False,False
Where can I throw a bloated lipo battery?,I've heard not to discharge it once it's bloated because it can worsen it. Where do I get rid of it? Will hobby stores help to take them and dispose?,wkv5g7,7,0.74,Discussion,2022-08-10 19:37:12+08:00,6,3nzxysel,https://www.reddit.com/r/singapore/comments/wkv5g7/where_can_i_throw_a_bloated_lipo_battery/,,False,False
What aspects of Singaporean culture should we make effort to preserve?,"Happy National Day! During a discussion with a friend, he said it is ironic that many young Singaporeans complain that Singapore is dull/boring/lacking culture, but then abandon/reject our diverse traditional cultural practices that make Singapore more vibrant. So let's discuss which aspects of Singaporean culture are declining but we want to preserve!

I want to preserve our community cat culture. In our fast-paced society, the cats are a great source of stress relief, available to anyone for free, because they belong to the community, not one household. They are also cared for by the community (some cats are fed by 2-3 makciks living in the same block) in a throwback to our kampung spirit. However, the community cat population is falling due to successful TNR program, less people feeding them and more accidents/abusers (reflects the bad side of our society), so we need more efforts to preserve our community cat culture.",wkv1jx,40,0.81,Discussion,2022-08-10 19:31:20+08:00,58,hnenpaga,https://www.reddit.com/r/singapore/comments/wkv1jx/what_aspects_of_singaporean_culture_should_we/,,False,False
Companies in Singapore in danger of losing talent over mental health and fatigue woes,NULL,wkv0o3,66,0.89,News,2022-08-10 19:30:11+08:00,25,6z4wpym0,https://www.straitstimes.com/singapore/jobs/companies-in-singapore-in-danger-of-losing-talent-over-mental-health-and-fatigue-woes,,False,False
No surgery required for Red Lions team member who had rough landing at NDP 2022: Ng Eng Hen,NULL,wkuyok,322,0.96,News,2022-08-10 19:27:08+08:00,47,2hm1qrxa,https://www.channelnewsasia.com/singapore/red-lion-jeffrey-heng-national-day-parade-hard-landing-no-surgery-required-full-recovery-rehab-2871916,,False,False
Teen arrested after allegedly posting tweet that an item would 'blow up' at Marina Bay's floating platform,NULL,wkuo8y,71,0.92,News,2022-08-10 19:10:48+08:00,35,2hm1qrxa,https://www.channelnewsasia.com/singapore/teen-arrested-tweet-suggesting-item-blow-marina-bay-float-ndp-2871846,,False,False
Return of the legend?,Found on sgfollowsall,wktufh,835,0.97,"Photos, Videos",2022-08-10 18:23:13+08:00,49,ch7kj93u,https://i.redd.it/omfsgh7d4vg91.jpg,,False,False
"Man jailed for assaulting and molesting sister, hitting wife with glass bottle",NULL,wktrxl,10,0.75,News,2022-08-10 18:19:05+08:00,6,o97gxzo0,https://www.channelnewsasia.com/singapore/man-molest-sister-assault-wife-domestic-violence-abuse-2871556,,False,False
"As an LGBTI+ person moving to Singapore, what should I know about dating, lifestyle, and finding networks?","I'm a cisgender gay man moving to Singapore in a few months, and I have some reservations about what my day-to-day life might be like as an LGBTI+ person in Singapore. This is my first time living out of very 'progressive' Western cities, so just a bit nervous!

Maybe these reservations are unwarranted, but I would love to gather some info/stories on what it's like. I'm a foreigner so I'm mindful my experience may differ from local Singaporeans.

Lots of posts here talk about 377a (rightfully so), but I'm also interested in knowing:

* what dating life is like - are most people comfortable going on dates in public (bars, cafes etc.)?
* to what extent dating/hookup apps are used (in the LGBTI+ sense not generally)
* are minor public displays of affection (briefly holding hands or kissing) frowned upon?
* are there particular areas (bars, events etc.) that the LGBTI+ community frequent?
* is it difficult to find an LGBTI+ network?
* and any other stories or info you may want to share!",wkte41,4,0.53,Discussion,2022-08-10 17:55:55+08:00,8,1wqpmqx3,https://www.reddit.com/r/singapore/comments/wkte41/as_an_lgbti_person_moving_to_singapore_what/,,False,False
Otters having breakfast at an early morning,NULL,wkt3gq,22,0.75,"Photos, Videos",2022-08-10 17:37:16+08:00,0,10vj06,https://v.redd.it/e2di40podwg91,,False,False
Singaporean woman spills the (green) tea on being a farmer in Japan,NULL,wksg13,39,0.84,Opinion / Fluff Post,2022-08-10 16:55:48+08:00,2,uazlr,https://www.asiaone.com/lifestyle/singaporean-woman-spills-green-tea-being-farmer-japan,,False,False
Sri Lanka's ousted president Gotabaya Rajapaksa expected to leave Singapore for Thailand,NULL,wksbaz,50,0.92,News,2022-08-10 16:46:53+08:00,13,3onsmzzo,https://www.straitstimes.com/asia/south-asia/sri-lankas-ousted-president-gotabaya-rajapaksa-expected-to-leave-singapore-for-thailand,,False,False
Sentosa homes,"Been seeing quite a lot of sentosa units being advertised. Price wise psf it doesn’t seem that crazy as compared to eg the new launches recently. However, nobody seem to be snapping up the units in sentosa. 

Anyone knows why?",wksaxt,17,0.76,Discussion,2022-08-10 16:46:12+08:00,22,op3fame,https://www.reddit.com/r/singapore/comments/wksaxt/sentosa_homes/,,False,False
"When I go to the hawker centre, I place a tissue packet on every empty table so people have something to clean up with after eating. What act of kindness do you do for strangers?",Inspired by a post on r/CasualUK for the Singapore version of kindness :),wksar1,2553,0.94,Satire/Parody,2022-08-10 16:45:51+08:00,354,8oqfmyft,https://www.reddit.com/r/singapore/comments/wksar1/when_i_go_to_the_hawker_centre_i_place_a_tissue/,,False,False
"Happy National Day, Singapore! (From a Migrant Worker who never got to see the NDP ever /s)",NULL,wks9ie,257,0.91,Opinion / Fluff Post,2022-08-10 16:43:31+08:00,8,g3psubhu,https://www.reddit.com/gallery/wks9ie,,False,False
From studying potential biological weapons to teaching pre-schoolers: A scientist’s unusual career switch,NULL,wkrxxs,1,0.52,News,2022-08-10 16:22:40+08:00,3,4l1qqy8i,https://cnalifestyle.channelnewsasia.com/women/extreme-career-switch-kids-and-kins-childcare-centre-catherine-ong-321821,,False,False
Feng Tianwei becomes first Singaporean to win outstanding athlete award at Commonwealth Games,NULL,wkrri4,115,0.91,News,2022-08-10 16:10:59+08:00,11,d998c9ok,https://www.channelnewsasia.com/sport/feng-tianwei-first-singaporean-win-commonwealth-games-outstanding-athlete-award-2871181,,False,False
Forum: Monkeys have been invading and harassing neighbourhood,NULL,wkr5ta,3,0.56,Opinion / Fluff Post,2022-08-10 15:31:43+08:00,15,51r50ub5,https://www.straitstimes.com/opinion/forum/forum-monkeys-have-been-invading-and-harassing-neighbourhood,,False,False
[OpenTaiko] Stronger Together - NDP 2022 Theme (All difficulties @ 3:10),NULL,wkqvpj,63,0.86,I Made This,2022-08-10 15:13:55+08:00,2,rfzya,https://v.redd.it/qwbqj08h6ug91,,False,False
Spicy Singapore Beef Noodles.,NULL,wkqfts,203,0.92,"Photos, Videos",2022-08-10 14:46:03+08:00,53,14ebbq,https://v.redd.it/b209hvwg1ug91,,False,False
translation literally.,NULL,wkplgn,479,0.98,"Photos, Videos",2022-08-10 13:53:34+08:00,42,1slkqqae,https://i.redd.it/o7wimau8stg91.jpg,,False,False
National Day: Preserving sovereignty in the information age,NULL,wkpldx,4,0.6,News,2022-08-10 13:53:27+08:00,2,j12uvl8e,https://www.singaporelawwatch.sg/Headlines/national-day-preserving-sovereignty-in-the-information-age,,False,False
GDC or CDC vouchers? Online supermarket's flyers baffle Serangoon and Hougang residents,NULL,wkp8lu,11,0.82,News,2022-08-10 13:32:17+08:00,5,bbse2o7b,https://www.asiaone.com/singapore/gdc-or-cdc-vouchers-online-supermarkets-flyers-baffle-serangoon-and-hougang-residents,,False,False
nationality noodles: Singapore,NULL,wkoprl,42,0.68,I Made This,2022-08-10 13:02:33+08:00,34,2ifoh1pa,https://i.redd.it/uvxr9ol5jtg91.jpg,,False,False
Visiting SG for the first time and took this photo at east-coast park,NULL,wkoaja,286,0.9,"Photos, Videos",2022-08-10 12:39:50+08:00,41,135fth,https://i.redd.it/bu87egf3ftg91.jpg,,False,False
SG has the 4th highest car theft in the world?,NULL,wko6ns,0,0.3,Opinion / Fluff Post,2022-08-10 12:33:49+08:00,14,s00pe,https://www.scrapcarcomparison.co.uk/blog/where-are-most-cars-stolen/,,False,False
Do longer out-of-school study hours translate to better student performance?,NULL,wknl9b,70,0.94,News,2022-08-10 12:02:20+08:00,13,ojuqd,https://i.redd.it/4zevydqe8tg91.jpg,,False,False
she is thankful to HDB for her BTO queue number,NULL,wkmj1y,914,0.94,"Photos, Videos",2022-08-10 11:08:37+08:00,122,lvhxhhj5,https://v.redd.it/62bmd8hrysg91,,False,False
Fairprice Radio,Does anyone know what playlist they play at Fairprice Xtra? Heard this one song at the outlet at Changi City Point that i really liked.,wkm0qe,0,0.21,Discussion,2022-08-10 10:43:00+08:00,11,74f6pr76,https://www.reddit.com/r/singapore/comments/wkm0qe/fairprice_radio/,,False,False
Fireworks from MBS yesterday. Happy belated Singapore!,NULL,wkli9o,39,0.76,"Photos, Videos",2022-08-10 10:16:57+08:00,2,3xtbw5ut,https://v.redd.it/2nfgwsi47ug91,,False,False
"Happy 57th BDay, Singapore!",NULL,wkjloz,11,0.6,"Photos, Videos",2022-08-10 08:43:59+08:00,4,bsjrhg38,https://v.redd.it/fq3vixu09sg91,,False,False
"""'It really hit home': Man caught on camera crying during National Anthem",NULL,wkijob,217,0.89,News,2022-08-10 07:54:27+08:00,43,67m06,https://www.straitstimes.com/singapore/it-really-hit-home-man-caught-on-camera-crying-during-the-national-anthem,,False,False
'Incredibly tragic': Singaporean man pleads guilty to murdering wife while on holiday in UK,NULL,wkiagx,34,0.88,News,2022-08-10 07:42:30+08:00,7,6z4wpym0,https://www.channelnewsasia.com/world/newcastle-alan-fong-soong-hert-pleads-guilty-admits-murdering-wife-evelyn-pek-ling-ying-2870041,,False,False
"/r/singapore random discussion and small questions thread for August 10, 2022","Talk about your day. Anything goes, but subreddit rules still apply. Please be polite to each other!",wkfyzc,13,0.76,,2022-08-10 06:00:11+08:00,681,6l4z3,https://www.reddit.com/r/singapore/comments/wkfyzc/rsingapore_random_discussion_and_small_questions/,,False,False
Advice on the process of getting an apartment in Singapore,"Heya,

Moving to Singapore in early September for work (EP). Absolutely excited!

I have a few questions for you seasoned apartment hunters.

First some context: I've found a few good studios and have had conversations with the realtors/agents (primarily through propertyguru and 99.co). Many of them are telling me that these places are really popular and will probably be off the market in a few days thereby forcing me to make a quick decision. 

What I'm afraid of is that the pictures and videos they've shared with me are not truly representative of what the apartment looks like. While I would love to take a look at them in person, I won't be in Singapore until September by which point, I assume, the apartments would've already been rented out. But the last thing I want to do is sign a 1-year lease on a studio apartment I'll hate.

Questions:

1. How often do Singaporean realtors / agents mislead with pictures and videos? Have you heard many stories of foreigners being burned by signing the lease on an apartment they haven't personally seen?

2. If I was to come to Singapore and look for an apartment while staying at a hotel, how long do you think I'll need to bunk at the hotel? I'm debating between a co-living space for 3 months vs a hotel for a month or 2. I know this is expensive but it's cheaper than the mental cost of disliking the place you're living in for a year.

Thanks in advance!",wkd13l,0,0.33,Discussion,2022-08-10 03:56:36+08:00,19,163lwe,https://www.reddit.com/r/singapore/comments/wkd13l/advice_on_the_process_of_getting_an_apartment_in/,,False,False
"George Yeo says he’s not running in upcoming Presidential Election to be held by 2023 - Mothership.SG - News from Singapore, Asia and around the world",Is it just me heaving a sigh of relief that he will not be running for President 😌😂,wkaw5f,23,0.69,Tabloid/Low-quality source,2022-08-10 02:32:32+08:00,70,61d7o5yi,https://mothership.sg/2022/08/george-yeo-presidential-election/,,False,False
That’s some serious inflation!,NULL,wk84em,0,0.35,"Photos, Videos",2022-08-10 00:43:19+08:00,2,9kmca,https://imgur.com/a/IOgLNbH/,,False,False
Red Lions parachute team member in stable condition after hard landing at National Day Parade 2022,NULL,wk74kx,34,0.84,News,2022-08-10 00:04:12+08:00,1,6z4wpym0,https://www.channelnewsasia.com/singapore/red-lions-parachute-hard-landing-ndp-2022-3wo-jeffrey-heng-stable-condition-2869251,,False,False
"NDP : move over Maverick, it's Mystique",NULL,wk66te,777,0.96,Meme,2022-08-09 23:26:48+08:00,116,atjca4y,https://i.redd.it/kxy0lb2mhpg91.jpg,,False,False
Happy late national day in VR!,NULL,wk5cdm,6,0.56,I Made This,2022-08-09 22:52:37+08:00,2,3mqo5nge,https://i.redd.it/7dg4oorgbpg91.png,,False,False
NDP used Attack On Titan OST,NULL,wk4vj7,289,0.95,"Photos, Videos",2022-08-09 22:33:30+08:00,56,64c1eppz,https://v.redd.it/3m4w0al38pg91,,False,False
Fly past at Punggol,NULL,wk3tp4,63,0.85,"Photos, Videos",2022-08-09 21:50:08+08:00,4,3tf0nm9m,https://v.redd.it/fjhvljuvhqg91,,False,False
SG AMONGUS,NULL,wk3ab1,769,0.96,Meme,2022-08-09 21:26:22+08:00,25,1rsbsncm,https://i.redd.it/iwh5y7u1wog91.png,,False,False
man moved to tears by our national anthem,NULL,wk34hj,473,0.94,"Photos, Videos",2022-08-09 21:18:56+08:00,61,l9c4d6nw,https://v.redd.it/kk5dzrmsuog91,,False,False
When there is work tomorrow...,NULL,wk2se4,321,0.95,Meme,2022-08-09 21:03:30+08:00,8,7m7rlnau,https://i.redd.it/pdqfsxk1sog91.png,,False,False
Happy 57th Birthday Singapore! You've filled my life with decades of creativity & colors. Thank you!,NULL,wk2scq,225,0.96,I Made This,2022-08-09 21:03:27+08:00,16,7l4lj1po,https://www.reddit.com/gallery/wk2scq,,False,False
"Tbh, this was a dare, turned out surprisingly good, happy bday Singapore! 🇸🇬",NULL,wk2ma3,97,0.79,I Made This,2022-08-09 20:55:55+08:00,11,9f7a89eb,https://i.redd.it/41abfc0pqog91.jpg,,False,False
NDP Over liao. Drop links to National Day sales pls.,"I'll start the ball rolling:

Haidilao got 20% Off Discount from all meat and vegetable items before 6pm. Promo ends on 11 August (Thursday)

 Häagen-Dazs 1-for-1 Ice Cream for takeaway orders. Promo ends on 14 August (Sunday)",wk2ijv,161,0.95,Discussion,2022-08-09 20:50:51+08:00,7,3chylo1l,https://www.reddit.com/r/singapore/comments/wk2ijv/ndp_over_liao_drop_links_to_national_day_sales_pls/,,False,False
Red Lion stretchered off after hard landing at NDP,NULL,wk2ias,67,0.9,"Photos, Videos",2022-08-09 20:50:30+08:00,7,ohw9j,https://youtu.be/ZM-pZHNzG9E,,False,False
Dude knows his priority in life,NULL,wk2d63,697,0.99,Meme,2022-08-09 20:43:40+08:00,23,litvih9,https://i.redd.it/yfnomm8ioog91.jpg,,False,False
Pic of the phoenix fireworks since many ppl were asking for it,NULL,wk2d4i,1239,0.98,"Photos, Videos",2022-08-09 20:43:36+08:00,65,5m8ji,https://i.redd.it/jcy2v6dfoog91.png,,False,False
Chevy Chase attended the parade,I didn’t know Piercecinald Anastasia Hawthorne was such a fan of Singapore,wk2bjm,168,0.9,Meme,2022-08-09 20:41:24+08:00,19,1hzxjwo3,https://i.redd.it/zscsh5k3oog91.jpg,,False,False
When government announces GST hike,NULL,wk257j,590,0.95,Satire/Parody,2022-08-09 20:33:02+08:00,12,4ux05,https://imgur.com/EyfUuot.jpg,,False,False
TBH I will cry as a man if Majulah Singapura was played overseas. Bless this guy.,NULL,wk20j9,1892,0.93,"Photos, Videos",2022-08-09 20:26:57+08:00,158,4du3w4ys,https://i.redd.it/zfuem23alog91.png,,False,False
"Long ago, the 4 races lived together in harmony. Then, everything changed when the Fire Nation attacked.",NULL,wk1o4c,520,0.97,Satire/Parody,2022-08-09 20:09:27+08:00,26,blchp06e,https://i.redd.it/zmgaeedeiog91.jpg,,False,False
Marina Bay Grand Prix Flythrough - Call of Duty: Modern Warfare II,NULL,wk184h,29,0.81,"Photos, Videos",2022-08-09 19:46:55+08:00,2,33snjug4,https://www.youtube.com/watch?v=iGIwZOC7hTU&feature=youtu.be,,False,False
Blackpink's world tour will include a Singapore concert on May 13 next year,NULL,wk0ni2,60,0.78,News,2022-08-09 19:16:08+08:00,9,6z4wpym0,https://www.straitstimes.com/life/entertainment/blackpinks-world-tour-will-include-a-singapore-concert-on-may-13-next-year,,False,False
The History of Singapore I guess.,NULL,wk0gk5,986,0.98,I Made This,2022-08-09 19:05:20+08:00,59,7vry7irv,https://www.reddit.com/gallery/wk0gk5,,False,False
Red Lion parachutist stretchered off during National Day Parade after incident at landing,NULL,wk0bn0,76,0.89,News,2022-08-09 18:58:20+08:00,6,2ulykn7y,https://www.todayonline.com/singapore/red-lion-parachutist-stretchered-during-national-day-parade-after-incident-landing-1965331,,False,False
When you take too many GrabFood orders but can't fulfill any of them on time...,NULL,wk01sj,258,0.97,"Photos, Videos",2022-08-09 18:42:32+08:00,66,fk3jf,https://imgur.com/ofwDxRL.jpg,,False,False
Last red lion being attended to,NULL,wjzurw,587,0.98,"Photos, Videos",2022-08-09 18:30:55+08:00,34,9h6lnfhu,https://v.redd.it/rcp7pvat0og91,,False,False
red lion hard landing,NULL,wjzlx2,1623,0.98,Serious Discussion,2022-08-09 18:16:33+08:00,190,2ymhf3ew,https://v.redd.it/gkatzmm7yng91,,False,True
Man seen eating leftover food at McDonald's outlet - here's how a diner made sure he had a proper meal,NULL,wjzjen,25,0.69,News,2022-08-09 18:12:29+08:00,8,bbse2o7b,https://www.asiaone.com/singapore/man-seen-eating-leftover-food-mcdonalds-outlet-heres-how-diner-made-sure-he-had-proper,,False,False
"Our Singapore shop houses would look so much more pretty and photogenic if we didn't have cars parking right beside them, like what Japan does.",NULL,wjzist,372,0.78,Opinion / Fluff Post,2022-08-09 18:11:26+08:00,132,am0eouxu,https://i.imgur.com/MVQL1QK.jpg,,False,False
"This morning, I woke up to seeing a rooster outside my room",NULL,wjz0qz,60,0.84,"Photos, Videos",2022-08-09 17:40:58+08:00,23,7p9svu7h,https://i.redd.it/svn7entwrng91.jpg,,False,False
Caik,NULL,wjyp9b,176,0.92,"Photos, Videos",2022-08-09 17:20:37+08:00,7,58as5dlr,https://i.redd.it/17jkszy9ong91.jpg,,False,False
Megathread: National Day Parade 2022,"*NDP 2022* returns today at 5.35pm! Here's a megathread to facilitate discussions!

Stream Links: [Mediacorp](https://www.youtube.com/watch?v=MXa4jMdVjfQ), [CNA](https://www.youtube.com/watch?v=gpgpggKhTts)",wjxxdd,212,0.95,Megathread,2022-08-09 17:00:38+08:00,1193,1ed93r63,https://www.reddit.com/r/singapore/comments/wjxxdd/megathread_national_day_parade_2022/,,False,False
"For National Day, I composed this military band arrangement: A march based on a well-known NDP song. I hope y'all like it, and happy 57th!",NULL,wjx3io,64,0.86,I Made This,2022-08-09 15:37:44+08:00,1,6gduftwk,https://v.redd.it/quthc6dl5ng91,,False,False
"Inflation at a new level, takeaway container charge additional 10% - The Independent Singapore News",NULL,wjwtcx,8,0.62,Tabloid/Low-quality source,2022-08-09 15:19:58+08:00,13,1eqdt8vc,https://theindependent.sg/inflation-at-a-new-level-takeaway-container-charge-additional-10/,,False,False
TikTok sensation Jeff Ng to make a special appearance at Gardens by the Bay picnic on National Day,NULL,wjwruw,0,0.09,News,2022-08-09 15:17:10+08:00,4,51r50ub5,https://cnalifestyle.channelnewsasia.com/entertainment/jeff-ng-national-day-gardens-bay-325571,,False,False
Is it legal for retailers to deduct service fee from gst refund of foreign customers?,"Some of my friends purchased products from Singapore and since they are travellers, they can apply for fast refund. But every retailer is charging around 30-40% service fee on that gst refund. Is it legal to do that?",wjwohr,17,0.79,Discussion,2022-08-09 15:11:05+08:00,8,acnm907c,https://www.reddit.com/r/singapore/comments/wjwohr/is_it_legal_for_retailers_to_deduct_service_fee/,,False,False
Question for DevOps/ platform/ SRE engineers in Singapore.,"I’m a recruiter In japan struggling to find experienced engineers in the above fields who are currently working in Singapore. Singapore is a hub for Asian software engineers but they are so difficult to find on LinkedIn.

Are these positions named something else in Singapore? Or is LinkedIn not popular in Singapore? Any suggestions?",wjvsxs,12,0.7,Discussion,2022-08-09 14:15:49+08:00,11,5xo4injs,https://www.reddit.com/r/singapore/comments/wjvsxs/question_for_devops_platform_sre_engineers_in/,,False,False
"'I just screw up a lot': Man loses passport in New Delhi, police find it 11 hours' train ride away",NULL,wjv3i3,237,0.91,News,2022-08-09 13:33:52+08:00,57,bbse2o7b,https://www.asiaone.com/singapore/i-just-screw-lot-man-loses-passport-new-delhi-police-find-it-11-hours-train-ride-away,,False,False
This made my day: Delivery rider dishes out pizzas worth $160 to strangers after cancelled order,NULL,wjv1u1,104,0.95,News,2022-08-09 13:31:21+08:00,8,bbse2o7b,https://www.asiaone.com/singapore/made-my-day-delivery-rider-dishes-out-pizzas-worth-160-strangers-after-cancelled-order,,False,False
Happy Neh-tional Day,NULL,wju0qd,1002,0.98,"Photos, Videos",2022-08-09 12:34:17+08:00,50,5kb8k,https://i.redd.it/k0ro3p479mg91.jpg,,False,True
S'pore e-commerce app apologises for sending out promotional mailers that look like official CDC vouchers,NULL,wju0a7,30,0.79,Tabloid/Low-quality source,2022-08-09 12:33:33+08:00,4,6z4wpym0,https://mothership.sg/2022/08/gdc-vouchers-gaigai/,,False,False
"Restaurants in court battle: The Social Outcast sues Ishiro for S$200,000 over alleged racist, derogatory comments",NULL,wjtv1u,82,0.91,News,2022-08-09 12:25:46+08:00,20,51r50ub5,https://www.todayonline.com/singapore/restaurants-court-battle-social-outcast-sues-ishiro-s200000-over-alleged-racist-derogatory-comments-1964756,,False,False
Does anyone remember a fighter jet simulator in Timezone?,As per the title did anyone remember a fighter jet simulator in Timezone in Tampines mall during 2007-2011? It was my favorite arcade game at the time and I cant seem to find any information about it. Thanks in advance.,wjtp46,24,0.82,Discussion,2022-08-09 12:16:51+08:00,14,9r9zhcq,https://www.reddit.com/r/singapore/comments/wjtp46/does_anyone_remember_a_fighter_jet_simulator_in/,,False,False
